<!ELEMENT libros (libro*)>
<!ELEMENT libro (titulo, autores?, editorial, precio)> 
<!ELEMENT autores (autor+)>
<!ELEMENT autor (#PCDATA)>
<!ELEMENT titulo (#PCDATA)>
<!ELEMENT editorial (#PCDATA)>
<!ELEMENT precio (#PCDATA)>

<!ATTLIST libro aÃ±o CDATA #REQUIRED>
<!ATTLIST autor id CDATA #REQUIRED>
